,School,Comment
819,Santa Clara University,Doing more action and spending money rather than emails saying genera statements
820,Colgate University,"good group therapy, needs more work w therapists that help mkre "
821,UMich,Counseling is widely available but could be improved in terms of quality
822,Ohio State,"PAL hotline is good, need more counselors since they often get booked"
823,Florida,More action to supporting mental health as opposed to verbally promoting it
824,UConn,The option to have appointments over the phone is very nice 
825,Florida Institute of Technology,Students who struggle need a safe and easy way to reach out
826,Oregon State University,We need more Zoom meetings about stress and how to handle school
827,UMich,Please provide mental health support for students with anxiety surrounding grades. 
828,Howard University,In-person counseling needs work but I've heard that telecouseling has worked well
829,Emory,I think just being able to understand workload and school life balance
830,Rochester Community and Technical College,"I have never used any services at RCTC, I seek help elsewhere."
831,BGSU,Everything is working well and BGSU addresses every mental health concern equally.
832,Rowan,"The limited resources work well, more expanded resources needed as campus expands"
833,Arizona State,"I haven't  personally used any, so I can't comm e nt."
834,Haverford College,CAPS is an accessible resource but it can only do so much.
835,Arizona State,There needs to be more easy to access mental health counseling. 
836,Arizona State,Unfortunately I am not using any of the mental health/wellness services provided.
837,UC Davis,Counseling services work well for those who are able to get appointments.
838,Colorado School of Mines,Not sure haven’t gotten any help. Professors should be more understanding though
839,Ohio Northern,They have a 24-hour hotline and a counseling center. I don't know.
840,Virginia,I heard that other students are not having good experiences with CAPS
841,Hamilton College,The peer counseling works well. The professional counseling needs more work. 
842,Georgia State University,I think mental health should be addressed more during freshman year 
843,University of Arizona,"I think th e telecounseling has worked very well, especially with covid"
844,UB,I wouldn’t know. I haven’t got to any programs or counseling 
845,University of Washington,"There are some counselors available which is good, but not nearly enough."
846,Brandeis,hotline is ok but it’s scary for people to reach out 
847,Tufts,I think they only advertise the resources when a bad event happens.
848,Arizona State,I didn't really know where to go as an online only student
849,Boston College,"Ithink the staff are trying their best, but we need more staff."
850,Florida International University,Professors should be more accommodating to students with mental health problems 
851,Michigan State University,Counselors and educating students on mental health services such as CAPS. 
852,Haverford College,The speed with which they respond to requests needs to be improvef
853,UMich,I think possibly medical mental health needs to be addressed more. 
854,Barnard,"Follow up on scheduling counseling appointments could use a lot of improvement
"
855,UC Davis,I have not used mental health or wellness services on campus. 
856,Hamilton College,There needs to be more wellness programming that isn’t just counseling 
857,Arizona State,the random activities where it's like free painting bring me temporary seratonin
858,Kent State University,Counseling works well. More attention is needed in reducing stress for students
859,Arizona State,im not sure. i havent really used my college's mental health services
860,Washington State,Outreach about mental health has been good. More resources would be better
861,University of Cincinnati-Main Campus,"Not sure, I have not utilized any of them at this time."
862,Iowa Central Community College,I think teachers need to be more understanding of students mental health.
863,Tidewater Community College,I haven't used/not familiar with mental health services provided by the school.
864,Horry-Georgetown Technical College,Mental health needs more attention because it really effects a person 
865,Pierce College-Puyallup,More checking in on students’ mental health and easy access to resources
866,Waubonsee Community College,I think the aspects that need more attention are depression and grieving
867,University of Nebraska-Lincoln,"I think we have counselors, but otherwise, I don't know these resources."
868,University of Alabama at Birmingham,Telecounseling is working well. Making appointments can be a bit difficult. 
869,University of Mary Hardin-Baylor,I do not use any because I worry about being judged. 
870,University of Nebraska-Lincoln,"I do not use on campus services, I see a private therapist."
871,Texas A&M,I don’t know much about the college’s resources so maybe more advertising.
872,Temple,I have never used the school’s mental health or wellness services. 
873,Wright State,Need more staff so the wait list and not super long 
874,Williams,"Ive heard IWS is good, but I don’t really know otherwise"
875,UT Dallas,Being able to take more mental breaks from course load. 
876,Rowan,Don't know.  We have a bad reputation for mental health
877,Bradley University,None. We have resources but they have shown to be inadequate
878,Utah,i think all aspects can work to improve the current state
879,UTK,"Counselling is good, but we need more if them for students."
880,Notre Dame,The counselors are great but there are not enough of them
881,New York University,"short term counseling is good, but no options for long term"
882,New Jersey Institute of Technology,Well i think the counselling is good and advisors do care.
883,Mercer ,My current counselor at CAPS is good at what he does.
884,University of Arizona,I haven’t used any of the resources so I don’t know
885,Columbia,Couldn't say-I don't really use them since they're not very good
886,Purdue University-Main Campus,I don’t think my university gives the attention that it deserves
887,Arizona State,I have no idea what they have available to me 
888,University of Hawaii at Manoa,I have not utilized the services provided through my university. 
889,George Fox University,"More qualified people counseling on campus, not just practicing grad students."
890,MIT,none worked well; needs a new head of mental health 
891,Utah,I am not sure. I have not used campus wellness services.
892,UC Berkeley,The mental health services included in the school insurance is nice.
893,Mercer ,The counseling center is pretty good and I use it somerimes
894,Siena College,I am not sure as I have not utilized the services.
895,UB,The fact that we are able to make appointments is great
896,Barnard,a lot people dont know much about wellness program on campus
897,Arizona State,"Health service physicians are very helpful, would like more group therapy"
898,San Diego State University,I wouldn't really know what works well or what needs attention.
899,University of Alabama at Birmingham,"I’m not sure, but there are way too few virtual options"
900,New York University,I haven't really taken advantage of the resources available to me.
901,Bates College,CAPS is good. Mental health groups to connect might be helpful.
902,Youngstown State University,"I have no clue what is going on, at YSU anymore."
903,Kent State University,"On site counselors

Activities scheduled throughout week like therapy dogs on campus"
904,Oregon,Telecounseling but I wish there was more options for longer term
905,Macalester College,The availability of in person counseling appointments are too limited. 
906,Carnegie Mellon,"CAPS
More attention to make services more appealing for students to attend"
907,Penn State,I think there is counseling that help to support the students
908,Muhlenberg College,athletes mental health should be checked on a lot more. 
909,Montana State University,We need more long-term counseling services. 6 sessions is not enough.
910,UC Berkeley,More activities for everybody that can just go chill and relax
911,Citrus College,I really appreciate all the counselors here at citrus college! 
912,Gwinnett Technical College,"Things geared towards stressors like faith, sexuality, and other conflicts "
913,Lansing Community College,I do not know. I have yet to use their services
914,Germanna Community College,None of the services my college offers are useful to me
915,Columbus State Community College,Communication with professors and customer service reps from financial aid office.
916,Oklahoma Baptist University,I know no services that are offered that are free. 
917,Johns Hopkins University,Lack of staff for long-term mental health counseling needs attention.
918,Notre Dame,I don't use mental health services provided by my college.
919,UMich,I think the advertising for mental health services is effective
920,Grinnell College,SHAW is fine but counseling is nearly impossible to book
921,Texas Tech University,I have not used any health services at my school
922,UT Dallas,"I'm not sure, I am not a mental health expert."
923,UB,Unsure as I don’t use on campus mental health resources
924,University of Arizona,There just needs to be more advertisement of services 
925,Arizona State,Health Services are being a big help in the college
926,Arizona State,"I haven't used them, so I can't be entirely sure."
927,Boston University,"I don’t know, I haven’t used the schools health/wellness services"
928,Emory,There is no communication and inaccessibility to receive resources. 
929,Ohio State,I’m not sure. I’m the mentally healthiest person I know
930,University of Kansas,none that i am aware of; more service options 
931,UC Berkeley,Support groups work well. Anonymity is a little more difficult
932,UConn,nothing is working well shaw is a waste of time
933,Ohio State,I have not used any of the schools services. 
934,Carthage College,None of them work well. Every aspect needs more attention
935,Arizona State,I have not used any of the college services 
936,University of Delaware,counseling is good and free but could use a psychiatrist
937,UC Davis,I'm not sure I have not really looked into it.
938,Mizzou,I don't know why do I have to answer this
939,Arizona State,Not currently utilizing any services or supports from my college.
940,Virginia,There needs to be support for anxiety and depression. 
941,Arizona State,I don't have enough experience to evaluate the services. 
942,Arizona State,I have never used college mental health or wellness services.
943,UB,The grief and counseling center are both doing well. 
944,Arizona State,I haven’t used it so I would not know. 
945,University of Central Florida,The ability to choose between telehealth sessions or in-person sessions.
946,Kent State University,the amount of services is great. the quality is horrible
947,West Virginia University,The metal health center needs more staffing for more availability
948,Colorado State,Therapy services to students are accessible but appointments are limited
949,DePaul University,Counselors are good but maybe more expansion on psychiatrist 
950,Virginia,They did not work well but I managed by myself
951,University of Arizona,I’m not sure. I am unsure of the options available.
952,University of Nebraska-Lincoln,Big Red Wellbeing is doing well. CAPS needs more attention.
953,Fordham University,Not sure of any / too shy to seek out
954,UT Austin,the mental health hotline we can call all the time
955,University of Alabama at Birmingham,They have the resources but arent fiving effective counseling 
956,Arizona State,That counselors are understanding and are willing to help. 
957,Arizona State,I feel like make it easier to schedule appointment. 
958,Arizona State,I really do not know much about these services 
959,UCLA,I haven’t explored the mental health services enough to know
960,University of Arkansas,I like CAPS on call and their let’s talk progeam
961,Virginia,I'm not entirely sure. I don't use any of them.
962,UTEP,It all depends what is going on around our community.
963,Barnard,there needs to be a more expansive program for counseling
964,Lehigh,Some professors are lenient towards taking mental health days. 
965,Jefferson College,I don’t know enough about what they offer to say.
966,Central Maine Community College,Nothing that I know of besides regular student counseling 
967,Naugatuck Valley Community College,The 24/hr virtual mental health is really helpful.  
968,Louisiana State University-Eunice,I’m not too sure. I have not used any 
969,Mott Community College,"Not sure, never heard of/used any services provided by college"
970,San Bernardino Valley College,"Groups on campus, along with over the phone counseling "
971,Arizona State,Diagnosing and being able to prescribe medications to needed students.
972,Syracuse,We have no more mental health days. Bring them back
973,Brigham Young University-Provo,More attention and direction on how we can get help
974,Johns Hopkins University,Long term therapy is not available through my institution.
975,Stanford,CAPS does outreach well but services are largely unavailable.
976,UConn,"Not entirely sure, I haven't used many of them"
977,UMass Amherst,I don’t know cause I haven’t used them 
978,University of Hawaii at Manoa,I've never used the services so I can't comment.
979,Carthage College,N/A. I do not seek help from the school
980,Virginia Commonwealth University,the vcu psychiatrist it’s fine but that’s about it
981,UT Dallas,"I am not sure, I have not seeked counseling."
982,IU,The current Iupui wellness service is known as CAPS
983,Rowan,I think my school does the best they can
984,Arizona State,"I attend college online, so I’m not sure. "
985,Georgia Tech,Need more counselors and staff for the CARE center
986,UIC,I have not used the University mental health resources
987,Barnard,I haven’t used any mental health services here yet
988,UCLA,I think we need more affordable mental health options.
989,Harvard,Inaccessible. Should be a modernized system to seek help
990,University of Minnesota,The fact that they have a clinic is good
991,UB,I’m not sure because I never went to one.
992,UMich,I think CAPS could use more staff and funding
993,Barnard,i think furman needs more funds and support 
994,UT Austin,Well going to go see a counselor is good.
995,Harvard,I think the school should have more diverse psychiatrists.
996,Oberlin,Telehealth seems to be working well but is limited
997,UB,The professors don’t seem to take mental health seriously.
998,Arizona State,I feel that ASU tele-communicaiton works very well. 
999,New York University,I'm not sure since I never used these services
1000,Arizona State,Free counseling is great and should be continued. 
1001,UC Davis,I believe that their counseling are pretty good. 
1002,Youngstown State University,"I don’t know, I do not use the services."
1003,Cornell,I think they need more diverse mental health specialists.
1004,Yale,"Services are wonderful, need to be more available "
1005,UC Berkeley,Outreach and emails work fine. Education about mental health
1006,Haverford College,CAPs program seems to be really helping students. 
1007,Oberlin,I don't know. They haven't done enough for me
1008,Haverford College,More attention needed for mental health aspects of students
1009,University of Arizona,I feel like there should be more student outreach
1010,UB,They have some framework in place to improve quickly.
1011,IU,I haven't experienced any of the mental health services
1012,University of Illinois at Urbana-Champaign,it’s nice that the counsels are pretty diverse 
1013,Northeastern Oklahoma A&M College,I really don't know much about the services offered.
1014,Wayne Community College,I’m not aware of any service offered currently 
1015,Housatonic Community College,I’m not sure I have not tried any 
1016,fdtc.edu,"Not sure, I haven’t personally used these services. "
1017,Middlesex County College,There is none currently I can think of 
1018,Santiago Canyon College,I think they general aspect of counseling services 
1019,Hutchinson Community College,I am unaware of any mental health services. 
1020,University of Minnesota,More available counselors that aren't weeks out for appointments
1021,Georgia State University,Not much can be said on that front. 
1022,Bob Jones University,Sorry I’m not sure.  Phone support maybe 
1023,Texas A&M,Overall the access needs to be made easier 
1024,Texas A&M,The accessibility of services needs to be improved. 
1025,California Polytechnic State University-San Luis Obispo,I am not familiar enough with them. 
1026,Grand Canyon University,I have not used any of these services.
1027,Ohio State,I dont really know what my college offers
1028,Tufts,Telecommunication services for counseling to make it anonymous
1029,Grinnell College,"nothing is working well.
The college is not helpful"
1030,Georgia,"affordable therapy options, need expansion for regular attendance"
1031,San Diego State University,I would say that EOP has helped me
1032,UMich,U-M needs more therapists.  It's that simple.
1033,UMich,CAPS and wellness workshops are going well 
1034,UT Dallas,I don’t know. I never used the services
1035,Washington State,I have not used any services.  
1036,Spelman College,Sessions go well. Need more sessions more often.
1037,Arizona State,I think the mental health dept. Is great
1038,Ohio State,having a therapist and having more appointments. 
1039,Skidmore College,I haven't used the on-campus wellness services. 
1040,Arizona State,Spreading awareness about mental health options and counseling
1041,Haverford College,Not sure. Haven’t had any experience with them
1042,CU Boulder,Online counseling; making it more anonymous or private
1043,Arizona State,I haven't used any so I'm not aware
1044,Michigan State University,It’s not bad but could be better 
1045,Arizona State,The counseling services could definitely use more attention
1046,UC Berkeley,I'm not sure since I don't use them.
1047,Youngstown State University,I have no idea what my school offers…
1048,University of Arizona,I am unsure due to not using them
1049,UB,It’s impossible to see an affordable trained therapist
1050,UB,counseling services are well. Make it less taboo
1051,Arizona State,Better mental health services for online students 
1052,Harvey Mudd College,Mental health and wellness programs are working well
1053,Sewanee-The University of the South,CAPS in-person therapy has been a great help.
1054,UCLA,transparency and discourse surrounding mental health issues 
1055,UMich,The UHS system needs to be improved 
1056,Arizona State,I haven't gotten access so I'm not sure
1057,Ohio State,I never used any mental health wellness services
1058,UC Berkeley,"Not sure, I have never used any services."
1059,University of Arizona,I believe the resources need to be shared
1060,UIC,Less school work and relaxing on the weekend
1061,Stockton University,i think the program overall needs improvement 
1062,University of Washington,i dont know the process of it 
1063,Arizona State,"I’m not sure, I haven’t used any yet"
1064,Arizona State,"I don't see much, idk what is good"
1065,Syracuse,Free services offered at the Barnes center 
1066,Arizona State,More awareness on anxiety and undiagnosed adhd 
1067,Haverford College,I think the mental health services are good
1068,Penn State,I don’t know of any services to mention
1069,UIC,I have not used any mental health service
1070,Stony Brook University,I have not used any of those services.
1071,Iowa State University,I don't use my university mental health services
1072,GW,I think the counseling center is just understaffed
1073,Arizona State,Not sure because I haven’t used these services.
1074,Florida International University,Overall the campus should support more free meals
1075,Arizona State,Not sure. Haven’t used them or inquired 
1076,Siena College,I have not tried any college supported services
1077,Washington State,I have not utilized anything through my school
1078,CU Boulder,"I did counseling last year, it did help"
1079,Norco College,In person mental health counseling is working well
1080,Iowa Central Community College,The way roommates are assigned. Roommates really help
1081,Barnard,I appreciate my professors telling me about Furman
1082,Frederick Community College,I don’t know enough to give real input
1083,Rowan College at Burlington County,Every one of them is going well. 
1084,Johnson County Community College,I don’t know. I’m not using any 
1085,Salt Lake Community College,The pricing on services is very helpful 
1086,Mission College,I don't know I never tried those services
1087,Brigham Young University-Provo,I don’t know. I haven’t used them. 
1088,CU Boulder,I don’t know about the resources 
1089,Binghamton,Haven’t reciprocate any mental health consulting 
1090,UT Austin,For certain people the telehealth is great.
1091,University of Minnesota,Good communication of what is available 
1092,UMich,too backed up. nobody can get appointments
1093,University of Arizona,on-campus health but they charge you 
1094,UConn,I would like to see more dogs
1095,Rutgers,availability i heard is s big problem
1096,Northwestern,"Not sure, have never tried school programs"
1097,California State University-Chico,"I'm not sure, I haven't used any"
1098,University of Alaska,I’m unfamiliar with the campus resources 
1099,Boston University,Non applicable. Haven't partaken in such services.
1100,University of Massachusetts-Lowell,UMatter2 club was a great creation 
1101,UC Santa Cruz,Resources for off-campus psychiatry and wellness groups.
1102,Haverford College,I don’t have problem with mental health
1103,Arizona State,I don’t know I don’t go 
1104,Arizona State,None that I am aware of 
1105,UTC,I need accessible mental health support services.
1106,Arizona State,It's hard to find counseling services 
1107,Tufts,Professors are understanding of mental health issues
1108,University of Arizona,Spread more info on what's available 
1109,UC Davis,Having extracurriculars that help develop support systems
1110,Arizona State,I didn’t know that we had any?
1111,Amherst,Therapists who take patients more easily 
1112,University of Arkansas,I never hear much about the services
1113,UNCG, Counseling sessions and mental health workshops.
1114,Barnard,Better relationship with Furman and academic departments
1115,Arizona State,Free therapy services and on campus psychiatrist
1116,University of Central Florida,I believe that diversity is more needed.
1117,University of Arizona,More services for off campus students 
1118,UCLA,Making CAPS very accessible and advertised 
1119,Hamilton College,I haven’t used the health resources. 
1120,San Diego State University,The counseling and social change department 
1121,Haverford College,I don’t know much about resources here
1122,Muhlenberg College,the therapists are not good at all
1123,Muhlenberg College,"Communication was horrible, staff was wonderful though"
1124,Boston College,I don't know. I don't use them
1125,Stony Brook University,Availability. Needs to work on feeling safe
1126,Barnard,Pressed to do well in school 
1127,UB,I’m not sure I haven’t used any
1128,Haverford College,I don't know I've never used caps
1129,Arizona State,On campus peer groups work the best
1130,Colorado School of Mines,I have not used any services. 
1131,UC Berkeley,communications regarding where to go if needed
1132,University of Central Florida,I have no experience with anything provided
1133,Haverford College,The stuff that OAR does seems helpful
1134,George Mason University,Counseling and psychological services are working well
1135,Arizona State,I am not too sure about this
1136,Alabama,Honestly a better psychiatrist would be great
1137,University of Minnesota,I don’t know how to reach out
1138,Carnegie Mellon,Not sure because I haven't used any
1139,UC Davis,Student health and counseling (medical and psychology)
1140,UB,i don’t know enough about them 
1141,UC Davis,Mental health counseling at the health center
1142,Syracuse,More free therapy services would be nice
1143,Rensselaer Polytechnic Institute,None from the college work at all.
1144,Arizona State,I like the physicians at health services
1145,Dartmouth,The availability of therapists is working well.
1146,Arizona State,I’m not sure; I haven’t used them.
1147,Haverford College,Outreach is good but availability is not
1148,Pittsburgh Technical College,The college counselor is amazing to assist.
1149,College of Charleston,Don't know what services are provided 
1150,University of Minnesota,The counseling services are accesible and good
1151,Western Wyoming Community College,I think health and wellness does great
1152,Iowa Central Community College,"Emotions, and people just need to listen."
1153,Community College of Baltimore County,The overall well being of students 
1154,Houston Community College,"Nothing I can think of, thanks "
1155,Santa Rosa Junior College,I like the virtual calls and zooms
1156,Sierra College,The counseling and EOPS are going well
1157,Hillsborough Community College,Support groups for students on campus 
1158,Roane State Community College,The services seem to be working well
1159,Montgomery College,I don’t know about any services 
1160,Brookdale Community College,Speaking with a counselor over the phone
1161,Front Range Community College,"hot line call, virtual talk. meeting. "
1162,Minnesota State College Southeast,I haven’t used or needed any services.
1163,Orangeburg Calhoun Technical College,Programs to help students with mental conditions
1164,Notre Dame,Simply creating more awareness would be good
1165,Michigan State University,Just the Student Services Center! OCAT! 
