,School,Comment
0,Texas A&M,"An aspect of mental health that needs improvement is that mentally ill people sometimes aren’t aware that they are unwell, and may not even consider they need help. Others that are aware are presented with hindrance stressors, like jumping through a bunch of hoops just to schedule an appointment. It was through a conversation with my advisor (which took me weeks to meet with because I was avoidant) to get an appointment scheduled with someone at SAS. I thought they were my counselor, but they only sent me resources to contact a counselor. Which is better than nothing. I do not want to complain. 

I do plan on meeting with a counselor because I’m willing to do whatever at this point to get out of this point of my life, however I don’t feel like making an appointment. I haven’t been able to complete my coursework; why would I prioritize scheduling appointments with counselors? 

So I feel as if the campus community could benefit from easy access to a counselor. I think every human being needs to attend counseling, anyways. The challenge would be to make it not too easy to schedule, otherwise it might be overused, and inefficient. "
1,Smith,"The therapists themselves are ok - although niche. I mean they work well for some. There’s not much diversity- and I know that smith says half are POC but when the total is 12, 50% of employees are still just 6. We need more therapists. It’s clear and fact that Smith students carry more trauma than other students (and that’s just starting from identity) so it’s a no brainer that 12 isn’t enough. Especially with an over enrolled school - we didn’t have enough therapists before and now we certainly don’t have enough. We took a mental health survey earlier that is apparently still being analyzed and I look at data all day. I’d be blind to still wonder if we need more therapists (especially when the weight of not having enough therapists can result in death)"
2,Johns Hopkins University,"Not nearly enough counselors or therapists, and they often just try to refer people outside of the counseling center. They make it pretty difficult to get signed up in the first place. They only want to do short term counseling before outsourcing people. I know a lot of people who just didn't like the staff as well and said they didn't take them super seriously. Also they only want to meet every two weeks. 

At least they provide it for free. Some people really like their counselors as well. I like mine. I'm lucky I only need some minimal talking and that I'm graduating otherwise I'd have been sent away as well which is such a mission to set up and probably expensive or a lot of work to set up with insurance. "
3,Duke,"Counselors need to be more diverse, as I've already mentioned.
My visits to CAPS in Fall 2019 were practically useless although I was on the brink of a mental health disaster in my life. Thankfully, I fixed my problems with the help of friends, family, and even strangers over the semester I took off in Fall 2020. This was only because those people truly understood my non-generic problems and were willing to give me time. They were willing to walk alongside me with my every day activities.

Maybe matching students who can help each other and both can actually give time of the day to each other might be also a good solution.

Another essential is having more counselors. I think being told to come back 14 days later is an absolute red flag. "
4,CU Boulder,"It is easy to get in contact with mental health services, but recently when I was going through a little crisis I called and did not get much help and it seemed like they got anxious and didn’t know what to do or say and kind of went super textbook with responding to me like explaining to me how anxiety works and I was like I know I have it and just not really helping. Another time freshman year I went to caps for help finding a therapist and they really didn’t give me many options that worked with my insurance so I took matters into my own hands and went through my insurance which was way easier and i found so many options"
5,Wellesley,"I don't really feel like too much is going well?? I have an off-campus therapist who I've been seeing since before I started college, but prior to the pandemic found myself looking for a closer therapist; Wellesley's services weren't helpful, and often bureaucratic. My psychiatrist who I saw all through high school passed during my sophomore year of college (fall 2020), leaving me without prescription access. Wellesley provided me a list of referrals, but I ended up having to contact my PCP to get a prescription to tide me over so that I would not be withdrawing from my medication. Overall..... I really think Wellesley needs to streamline the process of getting access to regular mental healthcare"
6,CU Boulder,CU’s mental health “department” is a shit show. They don’t care about students. They made a promise to bring on 20 new providers and actually fired 10 existing ones instead. When I reached my lowest low I asked for therapy twice a week instead of once and they discontinued my care entirely because of the request. The director did a coverup job and tried to conceal MY health records that I am legally obligated to. It took two months for me to finally have all of my health documents in my possession and I had to use a third party to force her to give me the information I was entitled to. 
7,CU Boulder,"I would not describe any of it as working well. Tedium and bureaucracy abound. Six complementary sessions with a provider per academic year isn't enough. General poor communication/knowledge of what's available. Met with a case manager once who quit or retired (unclear which) before a second meeting so I had to do the bulk of the intake stuff again. That case manager referred me to services that a therapist providing services through CAPS didn't know about. All this said, it's not clear to me if these problems are unique to my college, because as best I can tell nobody working in mental health has a good picture of the field. "
8,Haverford College,I think the main counseling service is helpful when you are able to get an appointment. I was on the waitlist for over a month and I know many other students have been waiting as well. I have been referred to a psychiatrist and there's a waiting list for that too. Mental Health is taken very seriously here but there are just not enough counselors for all the students. So there needs to be somewhere for someone to go when they are on the waiting list would be helpful. Even like a peer counseling service would be great. My high school had one and people used that often.
9,UC Davis,Once I was able to meet with a mental health counselor things looked better with my mental health. I was able to comfortably talk with my counselor and schedule regular sessions. My counselor also connected me to a case manager and through them I was able to find long-term therapy providers. I wish the Counseling center had more staff. It seems mental health concerns are more prominent in college and with the pandemic. The soonest I was able to see my counselor the first time was a few weeks out from when I scheduled it. But sometimes people need support that isn't necessarily a dire emergency. 
10,University of Arizona,"I think getting more people to focus ""living on the now"" would be very beneficial, a lot of my mental problems stem from either thinking too much of the past (friends I wished I stayed in touch with, social interaction I wished I acted differently in), or worrying too much about the future (what if I lose passion towards my major, what if some domino effect causes me to lose EVERYTHING I ever cherished in my life) (notice these unhelpful what-ifs), so getting the idea of get out of your head, stop overthinking, and just DO is something that has been helpful to me."
11,Lewis & Clark College,"I feel the college has notoriously let people down in regard to mental health services. It is difficult to receive ongoing counseling, many of the counselors that I've seen have been unfriendly or unhelpful, and it is extremely difficult to get a psychiatric diagnosis in order to receive accommodations. Above all, the majority of the counselors are white women, which makes it difficult to describe my experiences to them as a person of color and they often provide culture-blind strategies for dealing with problems. John Hancock has been the most helpful person to me, but he is unavailable for ongoing counseling appointments."
12,Illinois Valley Community College,"I'll be honest, I don't have time to take care of my mental health, so I don't. I'm stressed about the way the world is and this was before the pandemic even started. Ever since graduating high school, things have been different and way harder. Everything costs more, I finally get a job that can hold me over and I can afford to save up for my future and suddenly that's not good enough. Why raise the living wage if you're going to raise the prices of everything else? It leaves us back at square one and I can't afford jack anymore"
13,Lafayette College,"I think that it is really good that a lot of professors encourage and advertise mental health services available on campus. That being said, I only hear this at the beginning of the course and no other times afterwards. Furthermore, the resources for health services are only open on weekdays and it is so tedious to find where and how to schedule a time slot. And on top of that, I felt that the time when I went to visit the mental health center at the school, I felt that it lacked life and that I was talking to a robot."
14,UPenn,"CAPS short term counseling does not work that well. Some student could much benefit from a longer client-therapist relationship but don’t have the time, money, or knowledge of finding a therapist from outside the University. CAPS referral service also was terrible and didn’t help me. The quality of CAPS therapists were hit or miss—I’ve tried over 4 different people. The university also doesn’t prioritize student mental health in general, having a “wellness week” does nothing in comparison to actually having policies regarding attendance, longer and/or more frequent breaks, not letting professors assign work during breaks, etc. "
15,Rochester,"Counselors on campus are not experienced in the field. They are grad students who are not qualified to address extreme trauma such as sexual assault, domestic violence, and homelessness. I am also not comfortable with group/individual sessions being recorded and this have affected my ability to open up. There needs to be resources for long term therapy and better recommendations for therapists off campus. For context, I recieved NO help in finding a therapist off campus. There also needs to be flexible hours on weekends and evenings as students have classes during the day. "
16,Virginia,"We had two days for drop-in counseling where students signed up to meet with a counselor for 20 minute sessions. This helped me learn about some resources for myself. I don't have much experience with other mental health wellness services at my university, but I have heard from other students that there can be long wait times to meet with counselors and they're more a short-term solution (e.g., referring students to other therapists). There is a new telehealth counseling service which I don't know much about but it seems to address these problems."
17,Earlham College,"The psychiatric nurse practitioner is relatively accessible, which is good considering so many students have no access to healthcare outside of campus. Everything besides that needs more attention. There is no easy-to-find/access on-campus support for students who need to find a real therapist, which leads to these students receiving no mental healthcare because they have had such poor experiences with Counseling Services. Earlham needs someone who is dedicated to connecting students with in-network licensed therapists who they can continue to see during breaks and after graduation, ensuring continuity of care. "
18,New York University,"We have a 24-hour crisis hotline, which is a great resource with very little wait time (that I've experienced). However, probably about half the counselors employed at the student health center seem to be qualified for their jobs. Many seem to want you out of the office as quickly as possible rather than wanting to listen and help, and others are extremely oblivious to the realities of mental illness (i.e. a counselor telling me to ""just try harder"" to fall asleep when anxiety was keeping me up at night). "
19,Utah,"I don't know entirely what the full mental health services on campus are, but for me my biggest stressor right now is academics. I feel like school is so overwhelming I have had very little time for much else in life. I also feel like I am struggling with dating anxiety, that with rigorous academics and nearly two years of COVID isolation I don't know how to approach the opposite sex and engage in a relationship... which is frustrating since it seems to come naturally to my peers. "
20,Temple,"I haven't utilized the mental health services but I think that we should have more indirect services that support mental health. It can be less intimidating for students to go out to a mental health program that's beneficial to them than seeking a guidance counselor directly from my own personal experience. If there are resources, maybe they need a way to promote these better? A suggestion I have is to reach out to advisors of each college and ask for them to send out emails/announcements about these events."
21,Stony Brook University,"I have only utilized CAPS as a resource. I believe this has worked well due to how much I love my counselor. However, it took a while to get to her. Before this, I was placed with a counselor (who was a man when i asked for it not to be) who asked extremely invasive questions and was very misunderstanding. it warded me off from caps. i’ve also heard other people caps takes way too long to get back to them and doesn’t have enough room."
22,University of Wisconsin-Madison,"I have never explicitly used the services given by the college, although looking back there were points where I probably should've. I think more communication and general support from the university would go a long way, since there are probably others who have been in situations like mine. If I knew what services were available and how to receive them it would be easier to get them rather than having to do the research myself when I'm not sure what kind of help I want."
23,Arizona State,"The free counseling sucked, they need more faculty and especially more diverse faculty.  It got to a point where they were more focused on sending me to an off campus therapist than making sure I am taking care of myself and I dreaded talking to them.  They need to have an actual on-campus option.  I don't have a therapist because they're all so expensive and the on-campus staff is only really focused on short term rather than long term solutions."
24,University of Central Florida,"I love the space on the main campus, it's so welcoming and safe, it doesn't even feel like I'm on campus. I also like how many, not all, of the counselors, are licensed professionals, which gives me peace of mind. I think most students agree there needs to be more counselors or if not a good relationship with a network of counselors. Once you are in the system it's not bad to get an appointment, but the initial appointment is hard to get."
25,Cornell,"The university's approach to mental health has become a triage, turning permanent counseling services into temporary ones to aim to reduce suicides and severe mental health issues, at the cost of cutting long-term care to many students who relied on it. It's a backwards approach; the university needs to funnel a massive increase in funding to its on-campus counseling and restore its old system, as there are many students who feel they have nowhere to go anymore for mental health assistance. "
26,LSU,"I think the school at least has some sort of staff that can help students, but I'm very hesitant to ever use those resources since of all the bad things I have heard about it. I've heard that the staff isn't very attentive and doesn't really listen to students/clients and people's experiences just overall haven't sounded that good. There's a quantity of resources, but it seems like the quality of those resources isn't actually that helpful for those who are struggling."
27,Arizona State,"I don’t know what services are working well because I personally am unaware of the ones we do have. I think aspects that need more attention are those for students who are first generation. Ideas like imposter syndrome play a huge factor. You feel you don’t belong, no one relates, you’re unsure what job you’ll get outside of job, if any at all. I think there should also be more advising on helping students create plans for after college. "
28,Housatonic Community College,"The aspects of the mental health and wellness that need more attention are more professional counselors that can attend to the students who would like to make an appointment to discuss their mental health. Right now there are only 2-3 counselors available that attend to the 3,000 students on campus which sounds stressful enough as it is and having more counselors at the school, regardless of what race or gender a counselor is, will be beneficial to the students. "
29,Willamette,"Many students base assumptions on all staff based off of how we interact with the more common employees. Everyone who works at the front desk is very polite and helpful. But me and many of my (typically female-identifying) peers have felt unsafe, judged, and nervous around and with the nurses in Bishop Wellness center. They tell you rudely all of the things you could have done to avoid this problem rather than assisting us with the problem now. "
30,UMich,"They do have counseling services, however they are hard to access. Most professors are pretty welcoming but I think that if mental health days off were offered in the syllabi of classes that it would better to prioritize mental health. Given the esteem of the university, there is a lot of pressure to thrive and a lot of pressure to compete with your peers, helping to reduce that pressure would also be helpful for a lot of students. "
31,Arizona State,"I’m an online student, and I haven’t heard too much about many mental health services offered. I don’t know if it’s because I am an online student and it just isn’t as available to online students compared to on-campus students, but I think there should be options to have video appointments, and maybe have those professionals be able to look into referrals to professionals in that student’s area, so they can receive local help as well. "
32,Arizona State,I do not really know as I have not utilized this service from ASU. I do however know that ASU does a good job at advertising Counseling as an option for students. I have had several friends talk to me about their experiences with ASU counseling and that it is lackluster and they redirected them to people outside of the campus. It would be nice if they were trained to be able to deal with all issues.
33,UTK,"I seek mental health help with an off-campus therapist and am not very familiar with the inner workings of UT's on campus therapy/supports. I do think there needs to be more classroom/workload support for students struggling with their mental health. My biggest stressors and struggles are often directly related to my classwork and ability to succeed in class, and it feels like there is no support for those struggles that translates directly to classes and workload. "
34,Arizona State,"I feel as though we are told we have them which is great about telling us it is there, but does not give specifics about what they do, how they help. They seem as though it's like high school counselors, who can't help other than tell you ""it's okay, you'll get through it."" I've been told multiple times the ASU counselors not good compared to an actual therapist and that's why I have never gone. "
35,University of Minnesota,I think the clubs on campus are a great way to meet new people with similar interests and do something you enjoy together. Participating in things like clubs does wonders for the brain because it gives you something to look forward to and have fun with outside of classes. I think clubs in general need more attention and support from the university since they are places where most students meet and make friends on campus. 
36,Brigham Young University-Provo,"I think it is great that we have CAPS, and I know lots of students use that services. I'm not sure how it is recently, but I know in the past it was nearly impossible to get an appointment, especially last minute. I think it is really great that we have a coordinator who can help students find off campus care and I wish that more people were open to that kind of thing. "
37,Arizona State,"I'm cynical about finding a therapist who can actually help. Too many therapists, whether they are PhDs, MDs or social workers, just come off as glorified cheerleaders. I need an intelligent, insightful therapist, and I no longer believe I can find one. I haven't given my college a chance to help me because I kind of have the opposite of a placebo effect--I no longer believe any therapist or any drug can help me."
38,Brigham Young University-Provo,"It is widely known that if you need to see a counselor, it will take at least weeks to get you in if not a month or so. I think this is a big failing and students should be able to get support right away. You can always go to the CAPS office at any point for a one time visit but that is also hard to schedule and not widely advertised."
39,Purdue University-Main Campus,"I like how they promote the services, but the CAPS system isn't great. I have to call them, and I can never find a place to call them alone, meaning I have to call while around other people, which is very stressful. I wish they would accept emails or forms to register instead, as I don't feel comfortable telling the people around me that I need help with my mental health."
40,UMass Amherst,"Considering I haven’t used them very much but the few experiences I’ve had with it it’s been fairly ok. Mainly going through zoom calls and such but I feel a bit disconnected when doing it through this. And yes I know that due to the pandemic these services needed to be done through that, I just don’t feel online resources are the way to go at least for me. "
41,Cornell College,"I would consider our mental health facilities to be significantly lacking, although we have counselors they are just that, they don’t meet a lot of the requirements that college students need to win they are struggling severely with multiple mental health issues. One of the biggest things with that is that we only have three free visits a year and that is inadequate to any mental health needs"
42,Sewanee-The University of the South,"In general, there's lots of availability for individual counseling for mild mental illness, but trying to get help for particular issues is difficult because we aren't given bios for therapists. (We also aren't able to choose who we see.) I've already gone through several therapists because it hasn't been made clear to me that they don't specialize in what I need help with until a few sessions in."
43,Arizona State,"I am an online student living near Chicago. Aside from student-run groups and clubs, there doesn't seem to be as many options for online students who are in need of mental health and wellness services. I think that the school should increase the amount of options available to online students, and make an effort to clearly communicate those options to students so that they know there are options."
44,Northwestern,"I think it’s great that we have CAPS, but I don’t think that it’s big enough to service everyone who would benefit from it.  I’ve heard from many people that they waited months to get an initial appointment, which has caused me to skip that resource entirely and search for off campus options.  I’m lucky to have that option, but I know many students don’t."
45,University of Minnesota,"I have a few friends who have regular or semi-regular counseling meetings. They seem very grateful to have those sessions and look forward to the days they can talk things out with a professional on campus. I guess as someone who is interested in starting counseling, I don’t know where to begin so that may be something they could communicate more to both new and attending students."
46,MIT,"The fact that I know multiple people who were told they needed more support than MIT could provide and then just completely ghosted is absolutely abhorrent. If someone so desperately needs help that the counseling services at the school aren't able to provide it, they absolutely should be doing everything in their power to connect that person with off campus resources that can help them immediately. "
47,Arizona State,"I haven't really accessed the mental health/wellness services because the only ones I really know about are counseling. That costs money and I can already hardly afford college as is, so I never sought it out. But in terms of what may need more attention, I feel that students could benefit from boosting their self-worth/self-respect. I'm not sure what could be implemented to do that though."
