,School,Comment
383,UB,I’m not sure because I do not use any :/ I have heard people find it difficult to get quick appointments (usually a long wait)
384,Barnard,honestly i don’t use any of the services the college provides but i’ve seen others complain about how they weren’t treated well by the staff
385,Virginia,"The online services seem to be helpful from what I’ve heard, but it might be good to have a more diverse staff for it. "
386,West Virginia University,WVU has the Carruth Center that they frequently advertise. I’ve never visited it though so I’m not sure how good of a place it is.
387,University of Arizona,Focus on taking care of yourself has been emphasized. Understanding what happens if you do need to get help and what comes next is lacking.
388,Iowa Central Community College,"I'm not sure about college supported services, but I think the accessibility of therapy for college students is not the best. Coupled with insurance...not great."
389,UCLA,"The CAPS center and Black Bruin Center is working well at UCLA to help support students with resources, activities, and counselors regarding mental health."
390,Oklahoma State,"I have not used any of the campus resources concerning mental health directly, but my academic advisor is a huge help for me personally."
391,Campbell University,counselors have been a great help in assisting student about issues and stressors. athletes need more attention when it comes to mental health 
392,UB,"I think they do work well, i just wish there wasn't a limit on how many therapy appointments you can get in a semester"
393,Washington State,The only thing that works well are the handful of mental health professionals who actual care about the students and know what they're doing
394,Alabama,"The crisis line has been helpful to my friends that need it, but affordable access to on campus counseling services would help greatly "
395,Arizona State,"I haven’t interacted with my schools mental health resources; however, they’ve generally done well in terms to providing physical health resources like fitness classes"
396,Arizona State,N/A                       
397,Bates College,Need more staff for the number of students using them. Some of the counselors are not as helpful which deters students from using it
398,Arizona State,"Emails were sent at the beginning of the semester and the end saying that ""you are almost done!"" or ""Good luck with your semester!"""
399,Lehigh,"I have not personally used these services, but I see advertisements for them throughout the campus and assume these services do a good job"
400,Hamilton College,The actual counseling center works well but they get booked so easily. Also the college academically does not care about our mental health 
401,Oregon,"I feel it is most important to be able to have a hotline for students to have open 24/7, run by students for students"
402,University of Rhode Island,I really have not pursued any of these devices so I’m not sure but I’ve heard it can be difficult to get an appontment
403,Ohio State,Provided counseling but can only go once a month for a maximum of 6 months really sucks for people that need more help 
404,CUNY Hostos Community College,While I was home I felt that school was not worth it has I was home and not doing or going nothing much 
405,De Anza College,"I feel like they should make aware of what type of help is there from the college itself, and not having to search around."
406,Southern Methodist University,I have a few friends who use SMU's sports therapists and like them. I think student-athletes need more attention (especially the rowing team).
407,New York University,Everything needs more attention. I have a ton of friends with the same negative opinion and worse experiences with the NYU wellness center.
408,Northeastern,"Being able to get support via telecounseling is great. However, the process was very protracted, and I think it should be more accessible."
409,Bucknell University,"There are just not enough services available, a long wait time is not helpful for some people and makes their mental health worse"
410,Ohio State,"I have limited experience with mental health services at OSU. I would like to reach out for help, and talk to someone. "
411,Arizona State,I appreciate the counseling services and how they are very helpful. I think having a psychiatrist on campus would help even more. 
412,Arizona State,Honestly I have never needed nor heard of any mental health services around campus. Maybe more advertising for existing programs would help 
413,UCLA,I know students who would like someone to talk to but do not get replies back from the mental health services at school.
414,University of Arizona,"The quality of the services have been well but there needs to be more specialists available, especially in the resource centers on campus."
415,SUNY at Purchase College,Gettin counseling or someone to talk to is easy and quick I just wish it was easier to get diagnosed or getting medication
416,University of Arkansas,i think urec has done an excellent job with incorporating more group fitness yoga classes. that seems to benefit so many people. 
417,Arizona State,The mental health service that is helping students is the coaches that we get. It helps students to always have someone to talk.
418,University of Wisconsin-Madison,"I like department specific mental health counseling (e.g., for engineers). There are not enough providers though to make the mental health services helpful."
419,Arizona State,"There are issues with certain individuals who run the counseling program and how they interact with their patients. At times, it feels inappropriate."
420,Wellesley,"I think some of the counselors are okay at what they do. They're not amazing, but I definitely feel comfortable with them "
421,Muhlenberg College,I dont use them much so i dont know which are working well. They need more attention to allowing more sessions for students
422,Murray State University,Get people liscensed to talk ab substance abuse so they don’t kick people out and have to go to places that cost money
423,Utah,We only have one counselor at the Asia campus. She's nice but not every person works well with the same type of counselor.
424,University of Washington,I think there needs to be an expansion. One quarter of counseling is not enough to develop a relationship with a therapist. 
425,UB,"We need more relaxation areas to relax and calm down, e.g. a dark room to breathe, do Yoga, .... With reduced noise "
426,Virginia,they have a virtual counseling service which i think works well for people with anxiety about going into a physical counseling space. 
427,Youngstown State University,More breaks in terms of the semester. Or at least longer ones. That's something that has really screwed up a lot of stuff.
428,George Mason University,Counseling and mental health workshops work well. Possible promotion towards these mental health services to make them more well known could be helpful.
429,Haverford College,While CAPS is doing a good job it is my understanding that they need additional resources to better serve the college community 
430,Oregon,I think that the thing that needs the most focus on is making sure that we have complete access to wellness services 24/7
431,UTEP,"I suppose the on campus counseling when I was struggling in school during the Fall 2021 semester, not related to the pandemic "
432,Tufts,I think it has ok access and the service seems fine. My main issue is how hard it is to schedule sometimes. 
433,Arizona State,"The counselors are extremely nice and willing to talk, I just sometimes there were more qualified therapists that I could see long term."
434,Cerritos College, 
435,Tufts,"Mental health and wellness for BIPOC folk. Among this community, more support needs to be available for FGLI students and international students"
436,UC Davis,telehealth is working well but we need more support on campus for students who want to  talk to someone in person
437,Arizona State,I can think of one thing that works well. But as an online student referrals to services near me would be great.
438,Arizona State,"I find it difficult to schedule appointments during certain times of the semester with counselors, since all seem to be booked often."
439,Fordham University,i think that fordham could definitely use more mental health professionals so that there isn’t such a long wait to see someone.
440,Arizona State,I do not currently use mental health services provided by my college. Maybe if I heard more about it I would. 
441,Penn State,"As far as I’m aware, we have no mental health counciling. Or really help of any kind for the student body. "
442,University of Nebraska-Lincoln,"I have not reached out yet, personally, but I know some people who have had relatively good luck with CAPS counseling. "
443,Utah State University,"The people who check in when given a tip are fantastic, it's the follow through and long-term resources that need work. "
444,Binghamton,"There seem to be many services, but many of the people running them are students who aren't sure of what they're doing."
445,Pitt,I think there needs to be more diverse psychologists that can help students. also workshops that should be required for mental health
446,GW,GW and professors need to be more understanding and accommodating to students struggling with mental health instead of telling them to quit.
447,U of Toledo,I think my actual success coach has been helping. But the resources or knowledge of them need to be talked about more
448,UT Dallas,I think we need to pay more attention into helping students especially girls boost self esteem or encourage students to join clubs
449,Florida International University,the counseling on-campus helps students out everyday. FIU should focus more on online counseling because the pandemic forces students to stay home
450,Penn State,"I haven't personally used any of the services, so I feel as though I am not qualified to answer this question. "
451,Oklahoma City Community College,"I was not aware that Occc offered any mental health options, I think advertising it is something I would like to see"
452,College of DuPage,I would have never known that counseling actually would help with mental issues because it is more known for academic counseling. 
453,Mercer ,"They seem like they're trying their best but there just aren't enough counselors that can do the job that the students need
"
454,Texas A&M,I never used the campus resources so I could not say. I always see posters everywhere so I know that they exist.
455,UB,It needs to be easier to make an appointment and to to find ways for students to get regular therapy. 
456,Clemson,I am able to see a psychologist on campus. I think there needs to be more access for non student athletes
457,UConn,I think the activites that are held around campus. They send emails to invite students to talk about their mental health
458,Wellesley,"Access to counselors is simple (from my experience), but more counselors are needed for general outreach before students are in crisis."
459,Florida Atlantic University,"Instead of saying there are options, reduce the systemic pressure on students. Including high tution, horrible parking, and no coursework help."
460,Miami University,There is a long waitlist to see a counselor but I think it’s good that the first sessions are free. 
461,Arizona State,"The counseling services are great, I used it throughout the pandemic. Knowing how to connect with counseling needs to be addressed"
462,Arizona State,"It all has to do with rushing your assignments
One teacher was rude and didn't go over the DRC paperwork with me"
463,Penn State,"We have a program called CAPs but hardly anyone knows it exists, and it is very hard to get an appointment."
464,Tufts,It’s good that we have psychologists but we need more staff with diverse identities and who can diagnose mental health conditions.
465,UIC,sometimes student groups hold events to kind of give the students a break from school work and have a little distraction
466,Arizona State,More attention to anonymous survey or check in with students so they can receive advice what they can do about it
467,CU Boulder,I think it could have more staff to tell everyone about what is mental health and when do you need it
468,Arizona State,"While it’s not talked about much in ways such as emails, professors often provide links to learn so I appreciate that."
469,Miami University, 
470,Dartmouth,The activities and services provided by the Mental Health Union run by students and the Student Wellness Center are working great.
471,WashU,I’ve never used any of the services but most students find the services provided by the university as extremely unhelpful. 
472,UB,"Unsure since I haven't used any of said services , although I have heard mental health services have ridiculous wait times."
473,UTM,"I think the on campus one is working well, but we’re not doing anything for our outreach centers (ie parsons) "
474,Arizona State,"I haven’t really had the chance to use ASUs mental health services, and I don’t even know how to begin. "
475,Oregon,From my experience everything is working well. I think they would benefit from having more people staffed to help the students.
476,University of Delaware,I have never struggled with mental health issues. I do not know what my college needs to do or works well.
477,Tufts,"I'm not really sure, having not needed to use said services myself and relying on outside therapy in times of crisis."
478,UIC,Lower tuition and random fees. Stop charging top rate prices for mediocre education in an environment with sub-par resources and staff.
479,Oregon,College counseling seems to be working well. People should talk directly to me more if they really are concerned about me.
480,UB,"I personally liked meeting with a counselor 1 on 1, I guess just expanding that overall would make things even better"
481,Washington State, 
482,Mineral Area College,I think we have had a really good counselor who is always willing to talk to students who are struggling 
483,Santa Rosa Junior College,"The college doesn’t seem to promote it’s mental health facilities, so I don’t know enough about them to say anything good"
484,El Camino Community College District,"The group sessions for stress relief and meditation has worked great for me.
I believe more individual telehealth options would be great"
485,Alvin Community College,"I don't use the services, so I would not have a clue. But maybe improve group sessions or add them in."
486,Kalamazoo College,The counseling center of Kalamazoo college is known amongst the students to be generally very bad at the services it provides
487,Brigham Young University-Provo,CAPS is a good start but it’s not enough. It’s too difficult to access or learn how to get help. 
488,Santa Clara University,We need more education  programs on what to do when someone we know is facing a mental health issue
489,UMich,A hotline would be good. When I've been struggling with my mental health before I just wanted to call someone.
490,UMich,"The 24 hour line is good
Need more staff, the wait I heard can be a bit long
I've never gone though"
491,UConn,I think the teachers need to be more aware of what the students are going through and give more leniency.
492,Iowa State University,I know there is counseling available for students. I don't know about any other services or what exactly counseling entails.
493,University of Arizona,I would say the access to help during the day is beneficial however there needs to be 24 hour help
494,Arizona State,"I know there is an oncampus therapist, they can do a better job spreading the word about what’s available "
495,GW,In person counseling seems to be working well. The availability and the options for telehealth need to be expanded. 
496,Brandeis,Accessing the BCC is complicated. Transportation should be expanded to more locations to help people access off campus therapists 
497,University of Rhode Island,i think they have decent programs in place but not many people know about them or actually access them 
498,Ohio State,They send out a weekly newsletter and help reach out of ways you can feel closer to people right now
499,Boston College,"They are direly understaffed in terms of therapists, many of my friends struggle to make even a first appointment. "
500,Florida International University,our therapists need to be more responsible and make more of an effort to reach out to their patients 
501,Bowdoin,"Free counseling is great, but it can still be hard to access and take a while to get  "
502,Arizona State,i haven’t tried the counselling services at asu but i’ve heard from others that at asu it’s not good 
503,Barnard,"I believe that for many, the addition of having 6 1 hour therapy sessions is helpful for short term help"
504,Arizona State,I like the availability of counseling and that it is at no charge — though have not used the service.
505,Virginia,"Caps work okay, but office hours or open hours for students to get mental health help would be useful "
506,University of Minnesota,It is fairly easy to get in for an intake appointment. There are usually opening within a week or so.
507,Arizona State,"I have not used my college’s mental health services, so I do not feel qualified to answer this question. "
508,University of Minnesota,I feel like the college in general is lacking. They advertise they care but I don’t feel like it’s genuine.
509,Barnard,I think the overall attitude towards prioritizing mental health is good. I have not had much experience with individual services
510,Georgia,There are not enough counselors so i have heard it is hard to have appointments at a necessary frequency. 
511,University of Alabama at Birmingham,Just communication. I am glad that the campus does tell us where and how to review counseling if needed. 
512,Florida,"UF has a “U matter we care” that works well, but it takes a long time to get in "
513,Brigham Young University-Provo,Counseling and psychological services—that's the main program for mental health and any sort of need of the student to use.
514,Texas State University,"To be totally honest, I’ve heard nothing but negative things about the professionalism and effectiveness of UT mental health services."
515,Williams,"The fact that TalkSpace is offered is nice, the fact that IWS cannot fill their staff properly is terrible"
516,WashU,"There are a lot of peer counseling resources which I like, but there should be more professional, in-person options."
517,Rowan,There needs to be more opportunity for individual therapy before people are in crisis.  Not enough preventative measures.
518,Claremont McKenna College,The referral process works well but it should be even easier and there should be less wait time. 
519,Binghamton,I have yet to use services provided by the school. An anonymous hotline could be a good idea 
520,Utah State University,CAPS has been able to help me with counseling services and finding what is best for me right now.
521,Arizona State,"I'm not sure, I've had trouble figuring out what resources online students have, and I can't find very much."
522,Temple,nothing is really working well. more flexibility when it comes to attendance and mental health. drs is helpful though
523,IU,"Reaching out to the students, not a lot of people are aware of the facilities provided by the university."
524,Stony Brook University,"None of them are working well, the mental health advisors do not take the mental health of students seriously"
525,Carnegie Mellon,"One on one therapy works well, but the limitations on how many sessions of therapy are allowed are harmful."
526,Johns Hopkins University,They have a good group of therapists. But they don’t provide a ton of different areas of specialty. 
527,UB,I haven't used any of the services at my school but many other students say there should be more
528,Georgia State University,I am not familiar with the services offered by the school except that I know there are some available.
529,Mt Holyoke,I think teaching students how to cope with stress in a healthy way instead of with alcohol or drugs.
530,Oklahoma,"If you can get into Goddard for therapy, you’re golden. The wait to get into it though is ridiculous."
531,University of Arizona,"CAPS system seems to be working, I wish that they were more clear on their physical location operating hours"
532,Arizona State,The telehealth services appear to be working great and I am glad ASU provides free therapy sessions for students.
533,Wake Forest,The counseling center is unable to meet students regularly for counseling. It is only effective for students in crisis.
534,Arizona State,"I haven’t used these services yet, but aspects of mental health that need more attention is group wellness activities."
535,University of Nevada-Reno,Counseling center works well. Something that should be improved is having someone that can prescribe mental health medication 
536,Arizona State,"I hardly hear about the resources available concerning mental health.they are either nonexistent, too few or not well advertised."
537,Dartmouth,"I have received a medication evaluation and several counseling sessions, both of which seem to be going well. "
538,University of Central Florida,CAPS does cool events with puppies. I think they need to have more professional therapists versuses low level ones.
539,UNC,CAPS is an option that is good for students but it is limited in the help it can provide.
540,Laramie County Community College,I think they are doing well about letting you know that there are resources available if you are struggling.
541,Houston Community College,"I honestly do not know, as all of my classes became online only. Ive just been at home "
542,Iowa Central Community College,The mental health aspect needs more attention because us students still struggle even though we are continuing are education.
543,Cecil College,"Different diagnosis, and help for them. Some tips for struggling student who have weight on their shoulders from familu"
544,Lansing Community College,I think more attention should be brought to mental health and wellness in general (ex. how to manage stress)
545,Macomb Community College,I feel that the ability to speak with counselors on and off campus is working really well for students.
546,Nassau Community College,"I haven’t used any mental health services provided by the College, nor have I been informed of any. "
547,Anne Arundel Community College,The anxiety students feel when taking a midterm or final exam. Especially if they’re at risk of failing. 
548,Ohio State,I have not used any services because the tele services were always completely full when I needed them.
549,University of Arizona,"N/A

I am unaware of what services are provided by the school because I have not sought them out."
550,UConn,I think the university does stuff well but I also think some other stuff they do not well
551,New York University,The whole counseling program is seriously understaffed and ineffective. Did not feel supported or heard at all. 
552,UT Austin,There shouldn’t be a limit on the number of mental health service appointments a student can make 
553,Emory,The consistent emails let me know where I can reach out to if I needed help mentally. 
554,Hillsdale College,The counselors here are great and the professors really care and will listen to you talk about life.
555,Rochester,"I have no idea, but I have not heard of anyone having success with university mental health services"
556,Arizona State,"Not really sure, the way they go about mental health services just doesn’t motivate me to use them"
557,Oregon,I don't know as I have not paid much attention to it due to being a remote student
558,University of Maryland-College Park,I couldn’t tell you what goes into what category. I just didn’t receive effective treatment from them. 
559,Arizona State,They shouldn’t set limits on how many weeks you can see a counselor just cuz staff is limited.
560,George Mason University,"The quality of CAPS is not great at Mason, but it’s availability is good and is accessible "
561,Boise State University,"There are definitely known resources like counselors and group therapy, but it is difficult to get appointments. "
562,Stony Brook University,They have a lot but I don't know much about them in general since I don't use them.
563,UIC,I feel the use of tele-health has been expanded during Covid and can make a good impact 
564,Washington State,i actually haven’t used them because i’m not used to ask for help when i have to 
565,Louisville,"I don't know what's provided, therefore I think the services and programs should work on being more visible."
566,Arizona State,I personally have not used the mental health facilities on campus because they have a poor reputation 
567,UB,"There are many psychological consultants available for appointment, and you can talk about your troubles at any time."
568,UWEC,Having therapy dogs is very calming during stressful situations. I think more engaging options need to be available.
569,Wofford College,"I think our staff is great, just limited in time. Appointments are booked out months in advance. "
570,University of Nevada-Reno,I think it would be helpful if they advertise any mental health support options they do have more.
571,UC Berkeley, NONE. NEVER able to make an appointment with the psychiatrist or psychologist of the student health center
572,Arizona State,I have not attempted to use any mental health resource because I am primarily an online student 
573,Arizona State,I think the free counciling  has allowed more students to reach out and try services like that
574,Ithaca College,I'm not sure because I have not tried to receive mental health services or supports from my college.
