,School,Comment
129,Stony Brook University,"CAPS needs to add an option for students to schedule appointments online, not just over phone. I have friends who struggle with phone anxiety that would greatly benefit from counseling services, but cannot make the phone call to set up an appointment. "
130,CU Boulder,"Working Well: Communication of help available

Not Working Well: The help available. Student issues feel like they are not often taken as seriously as they should be and the clinic is often booked far out, meaning a student in crisis now cannot get help."
131,Wellesley,"What was the worst for me was the fact that the mental health resources of the school aren't available for study abroad students, which I get is due to licensing but I would have appreciated more resources being available during study abroad programs."
132,Barnard,"Not much in my opinion I’d working well. I think the diversity needs to increase for the counselors available, there really needs to be an increase in counselors too since scheduling is so limited and it could take weeks to get an appointment."
133,Arizona State,"Success coaching has been good, but could be more personal and those questions of mental health could be asked without pressuring the student. A personal connection to feel like someone is on your side and there to listen really helped in those meetings."
134,Harrisburg Area Community College,"I love that there is an option of taking a mental health day as a student, it goes a long way. Something that could be improved is the flexibility of the “mental health day” for students in a more fast paced programs(e.g nursing)."
135,Coastal Carolina Community College,"I mean, you have to actively look for someone like a counselor to help you.. I only know of people because I'm close to some faculty.. so there's no way to really know they're there without seeking, but they are always available. "
136,CU Boulder,"There are plenty of resources that are helpful like a certain amount t of free counseling sessions, but the staff are not diverse which does not help any students that would like to talk to someone they feel they can relate to"
137,Florida,"I think the short-term sessions are great, but the fact that it can take months to get a consultation before starting to talk to someone is ridiculous. A person’s mental state could severely deteriorate before they’re able to see someone on campus."
138,Arizona State,"There is a lot of awareness about resources, but that awareness does not translate to accessibility. For example, the SAILS program is mentioned often by professors, TAs, on-campus health staff, etc., but getting an appointment and getting accommodations approved takes weeks. "
139,Stony Brook University,I like the idea of CAPS but it seems very small compared to the need on a large campus. I have looked at it before but not sure if they had someone who could help for what I am looking for. 
140,University of Washington,"I don't really use the mental health or wellness services from my college, but I used the call system once and it didn't help very much since they weren't connected with the school. They weren't able to talk to professors or anything"
141,Haverford College,I don't really use any of the services on campus but I've heard from friends that they just aren't very good at what they do? I'm also aware that it's really hard to get an appointment and get a therapist on campus
142,WashU,The Habif mental health staff need more attention. There is such little staff that appointments are RARE. Uncle Joes is a good resource but students shouldn’t have to rely on peers due to inaccessibility to professional mental health services on campus.
143,Arizona State,"I haven't went to mental-health counseling because I take care of my mental health alone majority of the time, but I would say depression and anxiety are some major aspects of mental health that needs more attention that it already has."
144,Arizona State,I feel that the in person counseling services are very accessible. I feel like there is very little awareness of the limitations of the campus counseling and what steps a student should take to get help beyond steps 1 or 2.
145,Arizona State,I would say currently they have done a great job in making it known services are available and how to use said services. I would say there should be a way for them to focus past issues of anxiety and depression.
146,Arizona State,"I think that having counseling students intern as counselors is helpful because there is less intimidation when talking to them, but on the other side of that I feel as thought they may not be entirely qualified to help some people"
147,Ohio State,"I like the counseling that is offered but wish there was a way (covered by insurance) to get my medications. It’s so hard to get a psychiatrist appointment right now, and even harder to find ones that are covered. "
148,University of Alaska,I think it's a good thing that people with mental health issues can get special support.  I think it would be an improvement if people were given more opportunities to do activities with others that tend to improve wellness.
149,Arizona State,"An aspect that needs more attention is the understaffing of CS on campus, I know students that have gone for initial consultations only to be directed elsewhere after and they didn’t continue with that for one reason or another "
150,Washington Adventist University,"Telehealth has helped me alot with my mental health issues. However, I wish we had in-person counselors on campus because it is not the same talking to someone over a zoom call or on the phone as in person. "
151,UMich,"None, psychologist and therapist appointments are months out and if you go to them saying you're in an emergency you're locked up in the pysch ward for 72 hours with no beds, food, or phone access to call for help"
152,Youngstown State University,"I'm not to sure as I have not gone for help, but from what I have heard, they are quick to diagnose kids with ADHD and give them medication. Some kids' problems are more deeply rooted and greater than ADHD"
153,UIC,"The wellness center and the commuter center are great resources and communicate well through emails. I enjoy the events they organize.

I would like there to be more information about where and how to get in contact with a wellness counseler."
154,South Carolina,"There are options, and they are fairly knowledgeable.  However, they are too focused on crisis intervention and not focused enough on providing services for those who are not in crisis but still struggle a lot with their mental health."
155,UPenn,"The counselors and psychiatrists work very well when you can get an appointment. However, you generally have to wait weeks or months to get a first appointment and the physical location of the services is so far away from campus."
156,College of the Sequoias,"I have not used any programs, but I have noticed their availability and the schools encouragement to utilize those services. I think they have done incredibly well, but making private, over the phone resources more well known would be helpful."
157,UConn,"I think the on-call talks with social workers to get service or talk about the current struggles I may have at the moment. But, I wish there is more availability like a wider span of times and days. "
158,UMich,The counseling center is just burdened with the amount of students that need help. It's simply the volume of students that need help. The services aren't even that bad if they were just able to reach more people. 
159,Colorado School of Mines,"I can’t really say anything works well. I called our counseling center in spring 2021 and referred to an off campus online therapy service, had my appointments that I waited months for canceled twice. It was pretty disheartening "
160,Oberlin,"Current counseling services are lacking. Would MUCH prefer off campus counseling, also gives students a chance to get off campus, which in of itself feels like a suffocating prison surrounded by crime if you leave to the East "
161,Arizona State,"From what I know, the only type of mental support that exists on my campus is the counseling services we can go to but that's about it. Definitely need to provide a variety of options to seek mental health"
162,MIT,Expertise - I felt like I was talking to myself and solving my problems because my therapist didn’t give a professional opinion at a time when I thought I had many things wrong with me and needed clarity. 
163,University of Minnesota,"I tried reaching out to campus mental health service online last semester, which was when i needed the most help but didnt get reply till now. So now i just tried to not rely on them and help myself"
164,George Mason University,"Overall everyone was very understanding and were patient with me. However, the department only allows calls to set appointments which is not easy for those with mental health issues/concerns. Having an email system would be much more inviting. "
165,Alabama,I understand counseling is a profession but we pay so much in tuition and counseling on campus still costs money. Many don’t seek help because they cannot afford it due to the insane tuition prices they’re already paying. 
166,Barnard,"I think it would be more helpful to increase the amount of psychiatric services provided. I really appreciated that they were available, but getting access to them was very challenging, and they weren't a long-term solution, which was frustrating."
167,EKU,"whenever i’ve tried making an appointment with my colleges therapists, they never really have time slots available when i’m available, so i think it might help if they had more therapists available during more times throughout the day "
168,Louisville,None of them. We only have one counseling office and it was so backed up that it took me a month to even get a triage/meeting and they simply forgot to send me the email FOR the triage. 
169,Arizona State,"Ultimately, I believe that my university is very well educated on and equipped for offering diverse and more than sufficient mental health resources, and it now comes down to student choice and students approaching and accepting the proffered help."
170,UMass Amherst,There are not enough counselors and I have heard so many stories (including my own experience) where friends have wanted to go to counseling services and they are told they have to wait months to book an appointment
171,University of Arizona,"I think that there are a large variety of mental health treatment options to help students who are experiencing a wide variety of situations. However, I think it is not as accessible as it could be (price wise)."
172,University of Wisconsin-Madison,"My school has a 24 hour crisis line and counseling services available to all students. However, the amount of appointments that a student can have and the wait time to get an appointment is a serious barrier. "
173,Virginia,"Many students have complained that the therapists and counseling services offered through the University are unhelpful at best. Therapists are described as apathetic and dismissive of issues, while the pace of referrals and appointments is extremely sluggish. "
174,Arizona State,"I have never used counseling services at ASU; however, I have highly considered giving it a try. I would like more attention on being physically ""at peace"" (i.e. coming to terms with how you look, accepting your body)."
175,Salt Lake Community College,"I appreciate SLCC efforts for inclusion and diversity. Despite the fact that we still have a long way to go, I feel like SLCC does the best job out of all major universities/colleges in the whole state. "
176,Three Rivers College,There is one counselor that the college pays for (until fall semester this year) named Ryan Walker and he's been great. I just feel it's not a good idea to have 1 person for thousands of students. 
177,UC Berkeley,The undocumented student program runs individual and group sessions which supplements the times when you don't have an individual appointment. I think more staff should be hired so that they can reach more students on time. 
178,Stony Brook University,"No, they just redirect me to my in network resources, but they are generally very racist places to be, so very unhelpful. I ended up going through my primary physician after months of wasting time with SBU."
179,Arizona State,"The website and app seems helpful, but a little confusing! I tried to find a counselor, but then I got too busy and it didn’t work out, so I don’t have too much experience with it! "
180,UTK,"There are mental health resources widely available, which is extremely beneficial. However, there is such a long waitlist for counseling sessions, so my fear is that people who need urgent help are not going to receive it."
181,Arizona State,"I have not utilized the campus health or wellness services because I have my own resources that I consider more private. As an online student, I don't feel I have the same access that on-campus students enjoy."
182,UTEP,I feel that every aspect of that UTEP  has on mental health is going well. It would be nice to see more advertisements of our mental health resources on and off campus that are offered. 
183,University of Kansas,"I felt like the school just kinda pushed my mental health aside when I met with a counselor. They just referred me to a therapy group in the town, but I couldn’t go there due to insurance"
184,Miami University,Only time I've had experience with these services was when my professor let the school know I was going though a difficult time so you guys reached out. That was nice because it was prompt and helpful
185,UC Merced,They have a center called CAPS that you can make appointments with but they are always filled up. That is pretty much all they have so I'd wish they had more options or more space available
186,Tufts,I think the mental health department is good but just lacking funding and resources. It’s hard to schedule staff for counseling appointments and there also isn’t much importance placed on mental health in comparison to schoolwork.
187,Northern Arizona University,"they don't have enough counselors and they also don't really do a lot of specified work, but a lot of places off campus are wildly expensive, so there's limited options to get help for serious diagnoses/ESAs/etc."
188,UB,"We need more accessibility to on-campus counseling services. What UB has right now is not sufficient, especially when they don't really help and are hard to reach. The limits on counseling appointments is not helpful either."
189,Haverford College,"On campus free therapy, makes it affordable and an option for everyone on campus. We need more therapists, though, because wait times are extremely long. Also, a dedicated health and wellness building would be beneficial. "
190,University of Washington,I have looked at group counseling but they are still remote. I am tired of remote and don't want it simple because it's remote. If it were in person I would definitely go to group therapy.
191,George Mason University,"The help seems alright, I personally don’t know how to fix it. But I think for most students it’s scary going in for the first time so somehow making it more normalized or welcoming could help"
192,Utah,Theres a lot of resources which is nice but the biggest issue is a high turn over rate of college counselors which lessens wanting to seek help on campus and professors not being lenient/understand nag 
193,UIC,"I feel that at first the group therapy was helpful as a stress relief, but eventually it became an anxiety of having to participate and eventually feeling uncomfortable in that environment sharing my personal issues. "
194,Ohio State,"Students are advocating for themselves and their peers and the University addresses the fact that they need more mental health resources. At this point, we just need them to take action and do something about it."
195,Arizona State,"I haven’t been provided with very many services or supports, but it would be nice to have a mediator system to be able to mediate mental health discussions with resistant professors to be heard better"
196,Georgia,"I think the college needs to focus on getting more therapists and people to help students. I tried signing up for mental health services and was put on a waitlist, which didn’t help me any"
197,University of Arizona,"The services are intimidating to even learn about online, and expensive. It's futile to have mental health services if they aren't free; financial struggles are some of the biggest stressors leading to mental health crises....."
198,New York University,I know we have the wellness center but I have not used it. From my friends that have I hear staffing is the biggest issue since there are so many students and not enough counselors.
199,Emory,Timely MD was a great addition. Just all psychiatry as a whole. Students should be able to get in to see someone immediately. Mental health isn't something that can wait a couple of months. 
200,Rowan,"The mental health services in the Wellness Center are really good, as there are many different options for treatment. However, the college sometimes has a difficult time communicating these resources with the student population "
201,Arizona State,"I know nothing of the mental health services offered on campus. 

Even if I did, seeking them out would require me to pay even more for parking which already is a large financial stressor. "
202,Stony Brook University,"While I have not used the mental health services on campus, I am aware that they have a 24 hour hotline which I appreciate. However, I have heard that the counselling is not particularly useful"
203,Stony Brook University,I haven’t used any of stony mental health resources so i’m not sure but based on other peoples experiences i believe they should have a 24 hour service with people who are more empathetic 
204,Stony Brook University,"The student support team at my college has been very helpful in supporting my mental health.

I think more attention should be paid on the negative impact of stress from school has on students' mental health."
205,Virginia,"The counselor I saw was very kind and helpful in connecting me to resources. However, emergency services are lacking and therapy visits can only do so much for the overall wellness of the student community."
206,Davidson College," Mainly one counselor, Jasmine, has been helpful. Need more services/talks about nutrition/body image for students of color and athletes of color because Elizabeth Allred is not a safe space to discuss either of those."
207,University of Nebraska-Lincoln,"The college provides very limited mental health support. It is there for small issues, like friendship or homesickness. It is NOT for deep rooted issues or anything further than a little anxiety and depression"
208,New York University,"What’s working wel is they’re heavily connected with external sources. However, I do think they need to hire more psychiatrists so that people can quickly go through REAL treatment and be prescribed medication. "
209,Sewanee-The University of the South,Nothing works as well as it should.  We need more counselors and psychologists who will help and not collect an hourly coin as my friends share their issues with no guidance or resolve.
210,University of Arizona,"CAPS is working particularly well, but only for short-term issues. I wish there was a better option for long-term therapy with less focus on doing well academically and a bigger focus on holistic outlooks"
211,University of Washington,"Maybe something surrounding family. I know from experience that talking about your mental health and emotions isn’t something families to normally and it makes it extremely hard to open up, even to friends "
212,UB,"I hear none, and the major I'm in(Computer science) is not taking care of the feeling of the students at least in my perspective. There is just a due day over another due day."
213,UNC,One on one counseling was working well. However this support was short term. I did it for a semester but there is not many options for support for me on campus after that semester.
214,University of California-Santa Barbara,"I think that there needs to be greater accessibility to on campus counseling and therapy. If it was easier to get an appointment, or talk to someone over the phone, it would be easier"
215,Youngstown State University,My experience with the colleges mental health services was perfect I can't really suggest anything to improve it beyond what I experienced. However that does not mean there is not room for improvement somewhere.
216,Arizona State,"Telehealth is easily accessible. But I hope there’s more information on mental health and how to handle it whether it would be you or your friends. Also, more information on how to get therapy."
217,Arizona State,I think there needs to be more options for Online students. I get all the info about on campus options but I’m not ever on campus - I’m an out of state student. 
218,UMass Amherst,I think the university does a good job advertising different support groups but I think that there should be more access to counselors. I have heard that it is difficult to find an appointment
219,Oregon,I think virtual counseling/telecounseling through Zoom has been extremely helpful because more students are willing to seek help when they don’t have to meet the counselor in person due to anxiety and other reasons.
220,Moody Bible Institute,The MTS Counseling Center is flexible with their pricing which I really appreciate. I think that there needs to be more map instructions/how to get to counseling's physical locations in the counseling posters. 
221,Brigham Young University-Idaho,There is a counseling center but it is always booked months out and by the time you get to a meeting I’m not sure your concern would be needed to be addressed anymore. 
222,Stanford,"Haven't used it to know--but from my impression limited attention is given to men/male issues due to sexism, and inability to address issues faced by Christians being persecuted (for instance from own family)"
223,Ohio State,"OSU’s counseling and consultation services is a complete mess. It is advertised as a therapy option, yet students in crisis aren’t able to get in for months, and the help is near useless"
224,Rutgers,"One-on-one Therapy Talks 

Aspects of mental health and wellness that need more attention would probably be more of a psychiatrist on campus that can diagnose if someone has any sort of disorder. "
225,College of Charleston,"I can't say I've used any services personally, but I know there's always signs and posters for the cougar counseling and the texting line thing that they have, and that seems good. "
226,UIC,"I have not used any of them, but I heard that my classmates really appreciate the services that the college offers. Although I do feel that they should advertise these services more. "
227,UC Riverside,Yeah I’ll be there at around noon and I just got home and I’ll get back home from church lol I have a lot of stuff going to my house so I’ll 
228,Tufts,"We need so much more, it is impossible to get an appointment in an at all reasonable amount of time, and with mental health, this is a major issue and can be dangerous."
229,Emory,"I haven’t implemented most of the mental health resources, but I’d hazard a guess that, like in all other areas, Emory could stand to strengthen its communication skills in regards to mental health."
230,George Mason University,I haven’t used campus services because I get confused about the extent of the services provided. And word of mouth from other students about their poor experiences made me doubt campus services. 
231,Arizona State,In my opinions I don’t think any of the ASU offered wellness services work. They are never really able to help students. I think the entire department needs to be reevaluated and help.
232,Wheaton College (1),I would like more on-campus assistance regarding the diagnosis of mental illness or learning disabilities. I'm currently in the process of seeking a diagnosis and I wish there was more support on campus.
233,Western New England University,"I am not sure; I have not used any yet. I believe spreading information about services, specifically counseling services, should get more attention. Maybe looking at doing in-person counseling should be looked at."
234,UTEP,I believe that the concealing is working very well on my campus however showing students how to use it and why it is important to use it is an aspect that needs attention
235,Santa Barbara City College,I’m not sure; I’ve sought mental health services outside of school because of concern that struggles I’ve had related to the nursing program would be shared and jeopardize my success in it. 
236,UConn,the cheap sessions offered by grad students supervised by professionals seems like a really good way to give everyone access even if they dont have insurance or dont want their parents to know
237,UMich,"To be honest, they always say there are opportunities, but I've heard plenty of horror stories from both UHS psych and bad experiences at CAPS that I hesitate to rely on them"
238,Ohio State,"I gave up on my college's mental health services long ago. I reached out to them expressing that I was suicidal, and I was put on a four month long waiting list."
239,Florida International University,I believe the therapists being offered are working well because although I haven’t attended any therapy session I’ve had friends who have and they had positive things to say about it. 
